name,email,phone,linkedin,location,open_to,summary,skills,education
Swati Ghosh,swati.ghosh23@gmail.com,+91-7778754568,linkedin.com/in/swati-ghosh4,"Ahmedabad, India",Remote / Hybrid,Full-stack engineer with 6 years at companies like PwC. Strong in RabbitMQ and Kubernetes. Led rewrites of legacy systems to modern microservices architecture.,"Java, SQL, MongoDB, Redis, Kubernetes, GCP, Azure, GitHub Actions, Git, RabbitMQ",B.Sc in Computer Science | NIT Kochi | 2011 | CGPA: 8.4 || ---
Karan Joshi,karan.joshi35@gmail.com,+91-8578383952,linkedin.com/in/karan-joshi3,"Pune, India",Remote / Hybrid,"Security engineer with 8 years building and operating SOC capabilities at Adobe. Expert in Firewalls, Burp Suite and threat hunting. Reduced MTTD by 27%.","SOC Operations, Burp Suite, Forensics, Network Security, Wireshark, Firewalls, PyTorch, Redshift",M.Tech in Information Security | BITS Pilani Chennai | 2013 | CGPA: 9.4 || ---
Kritika Patel,kritika.patel80@gmail.com,+91-7722488774,linkedin.com/in/kritika-patel1,"Gurgaon, India",Remote / Hybrid,Product designer with 12 years at Amazon working across mobile and web platforms. Shipped 34+ end-to-end design projects. Passionate about GKE and inclusive design.,"Istio, Terraform, ArgoCD, Datadog, Consul, AWS, GKE",B.F.A in Visual Communication | IIT Hyderabad | 2016 | CGPA: 9.7 || ---
Trisha Shah,trisha.shah20@gmail.com,+91-8578818119,linkedin.com/in/trisha-shah9,"Mumbai, India",Remote / Hybrid,"Data scientist with 7 years applying Hadoop, Redshift and XGBoost to solve complex business problems. Experience across recommendation systems, fraud detection, and demand forecasting.","XGBoost, LightGBM, Hadoop, Power BI, Feature Engineering, Computer Vision, A/B Testing, PyTorch, Data Modeling, Redshift, Tableau",B.Sc in Statistics | IIM Bangalore | 2019 | CGPA: 8.1 || ---
Anjali Reddy,anjali.reddy75@gmail.com,+91-8432407762,linkedin.com/in/anjali-reddy3,"Noida, India",Remote / Hybrid,"Performance marketer with 12 years scaling user acquisition at Capgemini. Expert in Meta Ads, PPC and Market Research. Grew organic traffic by 11% YoY.","Meta Ads, HubSpot, Copywriting, Market Research, PPC, Influencer Marketing, Conversion Rate Optimisation, Adobe Suite, Affiliate Marketing, Brand Strategy, Community Management, Email Marketing",BBA in Marketing | IIT Gurgaon | 2020 | CGPA: 8.9 || ---
Kabir Kumar,kabir.kumar81@gmail.com,+91-9755813451,linkedin.com/in/kabir-kumar7,"Chennai, India",Remote / Hybrid,"Data scientist with 7 years applying Tableau, A/B Testing and Data Modeling to solve complex business problems. Experience across recommendation systems, fraud detection, and demand forecasting.","Scikit-learn, XGBoost, NumPy, Tableau, BERT, A/B Testing, Statistics, Data Modeling, dbt, Spark, Transformers",M.Tech in AI/ML | Delhi University Delhi | 2022 | CGPA: 8.8 || ---
Pooja Mishra,pooja.mishra62@gmail.com,+91-8162807338,linkedin.com/in/pooja-mishra8,"Jaipur, India",Remote / Hybrid,Full-stack engineer with 3 years at companies like EY. Strong in GitHub Actions and Datadog. Led rewrites of legacy systems to modern microservices architecture.,"ArgoCD, Bash, Datadog, EKS, Site Reliability Engineering, CloudFormation, GitLab CI, GitHub Actions",M.Tech in Software Engineering | BITS Pilani Kochi | 2020 | CGPA: 7.6
Yash Banerjee,yash.banerjee14@gmail.com,+91-8711810227,linkedin.com/in/yash-banerjee9,"Kolkata, India",Remote / Hybrid,Brand and content strategist with 8 years at Oracle. Deep expertise in GAAP and building engaged communities. Led campaigns reaching 36M+ users.,"CA, Auditing, GAAP, CFA, Oracle Financials, Equity Research, FP&A",PGDM in Marketing | NMIMS Jaipur | 2012 | CGPA: 7.7 || ---
Suresh Nair,suresh.nair33@gmail.com,+91-7414206028,linkedin.com/in/suresh-nair1,"Gurgaon, India",Remote / Hybrid,"Talent acquisition specialist with 5 years. Hired 32+ candidates across tech, product, and business functions. Passionate about Information Architecture and data-driven recruiting.","Visual Design, Wireframing, User Flows, Information Architecture",MBA in Human Resources | NIT Kolkata | 2020 | CGPA: 7.4 || ---
Varun Menon,varun.menon84@gmail.com,+91-8365769590,linkedin.com/in/varun-menon7,"Bangalore, India",Remote / Hybrid,8+ years of product leadership at Wipro. Shipped 27+ features impacting millions of users. Passionate about Infrastructure as Code and building data-driven product culture.,"Loki, New Relic, Infrastructure as Code, Docker, Bash, HAProxy, CloudFormation",B.E. in Electronics | NMIMS Noida | 2014 | CGPA: 8.9 || ---
Shruti Pandey,shruti.pandey46@gmail.com,+91-8926516622,linkedin.com/in/shruti-pandey9,"Delhi, India",Remote / Hybrid,8+ years as a Research Scientist specialising in SDR and Feature Engineering. Built production ML systems at TCS serving 13M+ users. Published 4 internal research papers.,"Transformers, Airflow, Statistics, Redshift, TensorFlow, Feature Engineering, BigQuery, Account Management, SDR",M.Sc in Data Science | NIT Kochi | 2019 | CGPA: 8.1 || ---
Natasha Gupta,natasha.gupta15@gmail.com,+91-8986827258,linkedin.com/in/natasha-gupta2,"Noida, India",Remote / Hybrid,"Sales leader with 7 years building outbound engines at Byju's. Expert in Wireframing, Agile and scaling SDR teams from 11 to 57 reps.","Wireframing, Mixpanel, Agile, Customer Discovery, Figma",BBA | IIM Chennai | 2012 | CGPA: 7.5
Natasha Gupta,natasha.gupta31@gmail.com,+91-8237503379,linkedin.com/in/natasha-gupta8,"Jaipur, India",Remote / Hybrid,"DevOps engineer with 6+ years building cloud-native infrastructure at Freshworks. Managed 37K+ container workloads on Kubernetes. Expert in MEDDIC, GCP and Upselling.","Jenkins, GCP, EKS, Consul, CloudFormation, Service Mesh, CRM, MEDDIC, Upselling",M.Tech in Cloud Computing | Manipal Mumbai | 2021 | CGPA: 9.4 || ---
Pallavi Sethi,pallavi.sethi88@gmail.com,+91-7284519096,linkedin.com/in/pallavi-sethi8,"Bangalore, India",Remote / Hybrid,"Security engineer with 6 years building and operating SOC capabilities at Unilever. Expert in Loki, Kubernetes and threat hunting. Reduced MTTD by 28%.","GKE, HAProxy, Terraform, Go, Loki, New Relic, Kubernetes, Site Reliability Engineering",B.Sc in Computer Science | NMIMS Chennai | 2016 | CGPA: 7.2 || ---
Mohit Choudhary,mohit.choudhary68@gmail.com,+91-9545571344,linkedin.com/in/mohit-choudhary5,"Ahmedabad, India",Remote / Hybrid,"5+ years in offensive and defensive security at PhonePe. Conducted 34+ penetration tests across web, mobile, and infrastructure. Holder of Conversion Rate Optimisation and PPC certifications.","Community Management, Conversion Rate Optimisation, Growth Hacking, Brand Strategy, Affiliate Marketing, PPC, Influencer Marketing, Programmatic Advertising",M.S. in Cybersecurity | NMIMS Hyderabad | 2016 | CGPA: 7.2 || ---
Suresh Patel,suresh.patel94@gmail.com,+91-8821351429,linkedin.com/in/suresh-patel5,"Delhi, India",Remote / Hybrid,"Data scientist with 3 years applying Hadoop, Kubeflow and Hive to solve complex business problems. Experience across recommendation systems, fraud detection, and demand forecasting.","Python, Hadoop, Hive, SQL, Kubeflow, NLP, dbt, Tableau, XGBoost",M.S. in Machine Learning | VIT Mumbai | 2020 | CGPA: 9.3
Shruti Sethi,shruti.sethi57@gmail.com,+91-9250161098,linkedin.com/in/shruti-sethi5,"Chennai, India",Remote / Hybrid,"Strategic HRBP with 9 years partnering with business leaders at Infosys. Expert in Performance Management, Talent Acquisition and building high-performance cultures in fast-scaling organisations.","Talent Acquisition, SAP HR, Onboarding, Performance Management, Labor Law, Training & Development, HRIS, Conflict Resolution, HR Analytics",B.A. in Psychology | Delhi University Ahmedabad | 2020 | CGPA: 8.0
Rohit Pillai,rohit.pillai29@gmail.com,+91-7497856074,linkedin.com/in/rohit-pillai1,"Delhi, India",Remote / Hybrid,9+ years driving growth through Video Marketing and Market Research at OYO. Managed ₹33Cr+ annual marketing budgets. Consistently delivered 65%+ ROI on campaigns.,"HubSpot, Content Marketing, Copywriting, Social Media, Market Research, Influencer Marketing, Video Marketing, Community Management",B.Sc in Mass Communication | Manipal Pune | 2012 | CGPA: 7.5
Shruti Rao,shruti.rao44@gmail.com,+91-7125381387,linkedin.com/in/shruti-rao7,"Noida, India",Remote / Hybrid,"3+ years designing intuitive, accessible products at Freshworks used by 15M+ users. Expert in MEDDIC and SPIN Selling. Known for translating complex problems into elegant solutions.","Figma, Interaction Design, Motion Design, Sketch, User Research, Negotiation, Solution Selling, SPIN Selling, MEDDIC",Diploma in UI/UX | NIT Gurgaon | 2010 | CGPA: 8.4 || ---
Kritika Nair,kritika.nair52@gmail.com,+91-7554757243,linkedin.com/in/kritika-nair3,"Chennai, India",Remote / Hybrid,"Sales leader with 4 years building outbound engines at Razorpay. Expert in SDR, Pipeline Management and scaling SDR teams from 12 to 57 reps.","SaaS Sales, Enterprise Sales, Lead Generation, Cold Outreach, Pipeline Management, Cross-selling, SPIN Selling, SDR, Channel Partnerships, Contract Negotiation",B.Com | VIT Pune | 2013 | CGPA: 7.9 || ---
Anjali Sharma,anjali.sharma96@gmail.com,+91-8727666622,linkedin.com/in/anjali-sharma7,"Kochi, India",Remote / Hybrid,"Sales leader with 12 years building outbound engines at Ola. Expert in Employer Branding, Talent Acquisition and scaling SDR teams from 2 to 37 reps.","Exit Management, Performance Management, Employer Branding, Talent Acquisition",PGDM in Sales | Delhi University Mumbai | 2017 | CGPA: 8.9
Aparna Nair,aparna.nair22@gmail.com,+91-7362602020,linkedin.com/in/aparna-nair5,"Chennai, India",Remote / Hybrid,12+ years as a ML Engineer specialising in Looker and PyTorch. Built production ML systems at Meta serving 26M+ users. Published 5 internal research papers.,"PyTorch, XGBoost, Looker, Spark, Keras, Python, Kafka, Due Diligence, Credit Analysis, DCF Analysis",M.Sc in Data Science | NMIMS Gurgaon | 2013 | CGPA: 8.6 || ---
Siddharth Naidu,siddharth.naidu60@gmail.com,+91-9522911681,linkedin.com/in/siddharth-naidu9,"Bangalore, India",Remote / Hybrid,5+ years of product leadership at Lenskart. Shipped 40+ features impacting millions of users. Passionate about Roadmapping and building data-driven product culture.,"Agile, JIRA, PRD Writing, Customer Discovery, RICE Framework, Mixpanel, Growth Hacking, OKRs, User Research, Roadmapping",B.Tech in Computer Science | VIT Kolkata | 2018 | CGPA: 7.7 || ---
Nikhil Saxena,nikhil.saxena64@gmail.com,+91-7716659945,linkedin.com/in/nikhil-saxena2,"Noida, India",Remote / Hybrid,"Product manager with 6 years driving 0-to-1 products and scaling existing ones. Deep expertise in OKRs, Roadmapping and working at the intersection of business, design, and engineering.","Roadmapping, OKRs, PRD Writing, Feature Prioritisation, MoSCoW, Growth Hacking, KPIs, Kanban, Agile",MBA in Product Management | IIT Noida | 2018 | CGPA: 8.7
Rahul Nair,rahul.nair98@gmail.com,+91-9959947085,linkedin.com/in/rahul-nair1,"Gurgaon, India",Remote / Hybrid,"Passionate Software Engineer with 11 years of experience across backend and cloud infrastructure. Proficient in SDR, Lead Generation, Enterprise Sales. Delivered systems handling millions of requests per day.","SDR, Cold Outreach, Lead Generation, Upselling, Revenue Forecasting, B2B Sales, Salesforce, Enterprise Sales",M.S. in Computer Science | NIT Chennai | 2020 | CGPA: 7.7 || ---
Shreya Choudhary,shreya.choudhary50@gmail.com,+91-8108724304,linkedin.com/in/shreya-choudhary3,"Hyderabad, India",Remote / Hybrid,10+ years driving growth through Google Analytics and Adobe Suite at Oracle. Managed ₹39Cr+ annual marketing budgets. Consistently delivered 68%+ ROI on campaigns.,"SEM, Google Analytics, Salesforce, Email Marketing, PR, Community Management, Adobe Suite, Programmatic Advertising, HubSpot, Conversion Rate Optimisation",PGDM in Marketing | NMIMS Kolkata | 2021 | CGPA: 9.0 || ---
Vikram Kapoor,vikram.kapoor83@gmail.com,+91-7918955604,linkedin.com/in/vikram-kapoor6,"Chennai, India",Remote / Hybrid,"Passionate Staff Engineer with 11 years of experience across backend and cloud infrastructure. Proficient in Jenkins, Microservices, Conflict Resolution. Delivered systems handling millions of requests per day.","Go, RabbitMQ, Jenkins, Node.js, REST APIs, Microservices, Labor Law, Conflict Resolution",B.E. in Information Technology | Delhi University Gurgaon | 2015 | CGPA: 9.5 || ---
Pooja Desai,pooja.desai25@gmail.com,+91-9308622617,linkedin.com/in/pooja-desai3,"Noida, India",Remote / Hybrid,HR leader with 9+ years at Goldman Sachs specialising in Talent Acquisition and Meta Ads. Built hiring pipelines for 19+ roles annually. Reduced attrition by 49% through targeted retention programmes.,"SuccessFactors, Talent Acquisition, Compensation & Benefits, SAP HR, LinkedIn Ads, Marketing Automation, Meta Ads, SEO",M.Sc in Organisational Psychology | NMIMS Hyderabad | 2010 | CGPA: 7.5 || ---
Siddharth Tiwari,siddharth.tiwari44@gmail.com,+91-9145295496,linkedin.com/in/siddharth-tiwari8,"Gurgaon, India",Remote / Hybrid,"Passionate Full Stack Developer with 5 years of experience across backend and cloud infrastructure. Proficient in Storyboarding, A/B Testing, User Flows. Delivered systems handling millions of requests per day.","Storyboarding, Sketch, Interaction Design, Card Sorting, User Flows, Framer, HTML/CSS, A/B Testing",B.Tech in Computer Science | IIM Kochi | 2020 | CGPA: 7.7 || ---
Swati Sinha,swati.sinha29@gmail.com,+91-7896946169,linkedin.com/in/swati-sinha7,"Ahmedabad, India",Remote / Hybrid,Growth-focused PM with 4 years at ICICI Bank. Grew core metrics by 54% through disciplined Growth Hacking and rigorous experimentation.,"Roadmapping, Figma, Miro, OKRs, Go-to-Market Strategy, Customer Discovery, MoSCoW, Growth Hacking",B.E. in Electronics | Delhi University Pune | 2018 | CGPA: 8.3
Vivek Malhotra,vivek.malhotra15@gmail.com,+91-8519879802,linkedin.com/in/vivek-malhotra7,"Chennai, India",Remote / Hybrid,Full-stack engineer with 2 years at companies like MakeMyTrip. Strong in AWS and Site Reliability Engineering. Led rewrites of legacy systems to modern microservices architecture.,"AWS, Go, Site Reliability Engineering, HAProxy, Datadog, Python, Vault",B.Sc in Computer Science | BITS Pilani Kolkata | 2019 | CGPA: 9.7 || ---
Pallavi Sharma,pallavi.sharma75@gmail.com,+91-7700820246,linkedin.com/in/pallavi-sharma4,"Bangalore, India",Remote / Hybrid,Product designer with 2 years at Flipkart working across mobile and web platforms. Shipped 11+ end-to-end design projects. Passionate about Figma and inclusive design.,"Heuristic Evaluation, Adobe XD, Figma, Design Thinking, User Flows, Product Analytics, SQL, KPIs",B.Tech in Computer Science | BITS Pilani Delhi | 2013 | CGPA: 8.9
Gaurav Agarwal,gaurav.agarwal27@gmail.com,+91-8163657733,linkedin.com/in/gaurav-agarwal5,"Mumbai, India",Remote / Hybrid,12+ years of product leadership at Groww. Shipped 28+ features impacting millions of users. Passionate about Competitive Analysis and building data-driven product culture.,"Agile, JIRA, Product Analytics, Python, A/B Testing, Go-to-Market Strategy, Competitive Analysis, PRD Writing, Growth Hacking, Mixpanel",B.Sc in Information Systems | NMIMS Kochi | 2012 | CGPA: 9.6 || ---
Suresh Pandey,suresh.pandey11@gmail.com,+91-7931743757,linkedin.com/in/suresh-pandey8,"Bangalore, India",Remote / Hybrid,"Sales leader with 3 years building outbound engines at Deloitte. Expert in Influencer Marketing, Video Marketing and scaling SDR teams from 19 to 46 reps.","Influencer Marketing, Conversion Rate Optimisation, Community Management, Content Marketing, Brand Strategy, Video Marketing",B.A. in Business Administration | NMIMS Kochi | 2020 | CGPA: 7.6
Varun Naidu,varun.naidu79@gmail.com,+91-9982930488,linkedin.com/in/varun-naidu9,"Bangalore, India",Remote / Hybrid,CA/MBA with 11+ years in DCF Analysis and LBO Modeling at Atlassian. Managed portfolios worth ₹6Cr. Strong track record in cost reduction and financial optimisation.,"Equity Research, Auditing, LBO Modeling, DCF Analysis, Docker, PostgreSQL, Linux",M.Com in Accounting | BITS Pilani Kolkata | 2019 | CGPA: 9.4
Rohan Reddy,rohan.reddy53@gmail.com,+91-8725836344,linkedin.com/in/rohan-reddy4,"Delhi, India",Remote / Hybrid,"12+ years building scalable distributed systems at Goldman Sachs. Deep expertise in Hypothesis Testing, SQL and REST APIs. Known for writing clean, well-tested code and driving architectural decisions.","MongoDB, AWS, Microservices, Docker, REST APIs, SQL, Redis, MLflow, Hypothesis Testing",B.Sc in Computer Science | Delhi University Jaipur | 2011 | CGPA: 9.2
Aryan Arora,aryan.arora39@gmail.com,+91-8230677683,linkedin.com/in/aryan-arora1,"Chennai, India",Remote / Hybrid,Investment analyst with 5 years covering Credit Analysis and Compensation & Benefits. Built 17+ financial models supporting ₹7Cr+ in deals. CFA Level 3 cleared.,"Credit Analysis, Budgeting, GAAP, Bloomberg Terminal, Tally, Training & Development, Compensation & Benefits, Exit Management",M.Com in Accounting | IIT Pune | 2010 | CGPA: 8.9 || ---
Deepak Kumar,deepak.kumar45@gmail.com,+91-9591942526,linkedin.com/in/deepak-kumar1,"Chennai, India",Remote / Hybrid,"Performance marketer with 11 years scaling user acquisition at Zoho. Expert in Marketo, Google Analytics and Marketing Automation. Grew organic traffic by 46% YoY.","SEM, Google Analytics, Marketo, Market Research, Marketing Automation, Adobe Suite, LinkedIn Ads, Affiliate Marketing",B.A. in Media Studies | VIT Chennai | 2020 | CGPA: 8.5 || ---
Shruti Pandey,shruti.pandey58@gmail.com,+91-7949037509,linkedin.com/in/shruti-pandey7,"Bangalore, India",Remote / Hybrid,"Finance professional with 2 years at HDFC Bank specialising in Excel, Tally and regulatory compliance. Led teams through 5+ successful audits.","Bloomberg Terminal, Accounting, Tally, FP&A, Credit Analysis, Due Diligence, CFA, Excel, Equity Research",CA (Chartered Accountant) | VIT Jaipur | 2011 | CGPA: 8.0 || ---
Ishita Choudhary,ishita.choudhary90@gmail.com,+91-7841720701,linkedin.com/in/ishita-choudhary4,"Mumbai, India",Remote / Hybrid,"Performance marketer with 8 years scaling user acquisition at SAP. Expert in SEO, Content Marketing and PPC. Grew organic traffic by 42% YoY.","SEO, Google Analytics, Content Marketing, Copywriting, CRM, PPC, Salesforce, Social Media, HubSpot, Marketing Automation",BBA in Marketing | NMIMS Hyderabad | 2013 | CGPA: 8.1 || ---
Rohit Sinha,rohit.sinha67@gmail.com,+91-8720201653,linkedin.com/in/rohit-sinha7,"Kochi, India",Remote / Hybrid,"Finance professional with 11 years at Lenskart specialising in Cryptography, NIST Framework and regulatory compliance. Led teams through 8+ successful audits.","CISSP, PKI, NIST Framework, CEH, Metasploit, Cryptography, IAM",M.Sc in Finance | Delhi University Chennai | 2021 | CGPA: 7.5 || ---
Vikram Ghosh,vikram.ghosh80@gmail.com,+91-8941880862,linkedin.com/in/vikram-ghosh8,"Jaipur, India",Remote / Hybrid,11+ years in Transformers and Keras at Byju's. Consistently exceeded quota by 76%+ over last 8 years. Closed deals totalling ₹2Cr ARR.,"Keras, Kubeflow, BigQuery, Feature Engineering, Kafka, LightGBM, Transformers, Data Modeling",B.A. in Business Administration | IIT Ahmedabad | 2017 | CGPA: 7.3
Aisha Das,aisha.das39@gmail.com,+91-7199240099,linkedin.com/in/aisha-das3,"Kochi, India",Remote / Hybrid,"ML engineer with 12 years at Netflix bridging research and production. Expert in Agile and PRD Writing model deployment, monitoring, and retraining pipelines.","A/B Testing, Agile, Mixpanel, Kanban, OKRs, PRD Writing",B.Tech in Computer Science | IIM Pune | 2022 | CGPA: 9.1 || ---
Deepak Pillai,deepak.pillai37@gmail.com,+91-8773540286,linkedin.com/in/deepak-pillai4,"Kolkata, India",Remote / Hybrid,"7+ years building scalable distributed systems at Infosys. Deep expertise in PostgreSQL, Terraform and System Design. Known for writing clean, well-tested code and driving architectural decisions.","TypeScript, Rust, REST APIs, PostgreSQL, Kafka, AWS, Terraform, System Design, GraphQL",M.Tech in Software Engineering | NIT Chennai | 2019 | CGPA: 8.7
Pallavi Saxena,pallavi.saxena81@gmail.com,+91-8582628398,linkedin.com/in/pallavi-saxena9,"Pune, India",Remote / Hybrid,"SRE with 3 years ensuring 36% availability for systems serving 6M+ users at Razorpay. Passionate about Docker, observability, and eliminating toil.","Angular, CI/CD, Docker, Jenkins, gRPC",AWS Certified Solutions Architect | NIT Noida | 2020 | CGPA: 9.6 || ---
Anjali Desai,anjali.desai44@gmail.com,+91-8655094022,linkedin.com/in/anjali-desai2,"Noida, India",Remote / Hybrid,Growth-focused PM with 10 years at Zomato. Grew core metrics by 49% through disciplined Confluence and rigorous experimentation.,"Mixpanel, Usability Testing, Stakeholder Management, Confluence, Wireframing, Bash, CISSP, Metasploit",MBA | BITS Pilani Kochi | 2013 | CGPA: 8.7
Tanvi Sinha,tanvi.sinha48@gmail.com,+91-7790770411,linkedin.com/in/tanvi-sinha5,"Kochi, India",Remote / Hybrid,6+ years of product leadership at CRED. Shipped 44+ features impacting millions of users. Passionate about Python and building data-driven product culture.,"JIRA, Confluence, Python, Wireframing, Competitive Analysis, Growth Hacking, Stakeholder Management, Product Analytics, Kanban, Miro",MBA in Product Management | NIT Jaipur | 2012 | CGPA: 7.2 || ---
Kabir Choudhary,kabir.choudhary77@gmail.com,+91-9422025509,linkedin.com/in/kabir-choudhary7,"Delhi, India",Remote / Hybrid,"SRE with 9 years ensuring 27% availability for systems serving 32M+ users at Browserstack. Passionate about PR, observability, and eliminating toil.","PR, PPC, Salesforce, Email Marketing, Marketing Automation, Influencer Marketing, Video Marketing",CKA Certified | Delhi University Pune | 2016 | CGPA: 9.8
Natasha Nair,natasha.nair96@gmail.com,+91-8369539459,linkedin.com/in/natasha-nair3,"Gurgaon, India",Remote / Hybrid,Growth-focused PM with 9 years at Groww. Grew core metrics by 40% through disciplined Agile and rigorous experimentation.,"Kanban, Python, OKRs, Customer Discovery, Feature Prioritisation, MoSCoW, Agile, Roadmapping, RICE Framework",B.Tech in Computer Science | Manipal Pune | 2012 | CGPA: 9.7
Rahul Sinha,rahul.sinha37@gmail.com,+91-7347635067,linkedin.com/in/rahul-sinha3,"Bangalore, India",Remote / Hybrid,"5+ years in offensive and defensive security at Paytm. Conducted 25+ penetration tests across web, mobile, and infrastructure. Holder of Forensics and Network Security certifications.","Network Security, Bash, IAM, Forensics, Onboarding, SuccessFactors",B.E. in Computer Engineering | Manipal Jaipur | 2018 | CGPA: 9.5 || ---
Varun Shah,varun.shah31@gmail.com,+91-8285841389,linkedin.com/in/varun-shah2,"Gurgaon, India",Remote / Hybrid,Brand and content strategist with 4 years at Cognizant. Deep expertise in RICE Framework and building engaged communities. Led campaigns reaching 23M+ users.,"JIRA, OKRs, Miro, Roadmapping, RICE Framework, SQL",M.A. in Communications | VIT Bangalore | 2018 | CGPA: 9.4 || ---
Aisha Sinha,aisha.sinha59@gmail.com,+91-9680424495,linkedin.com/in/aisha-sinha6,"Ahmedabad, India",Remote / Hybrid,Brand and content strategist with 3 years at Unilever. Deep expertise in DLP and building engaged communities. Led campaigns reaching 23M+ users.,"PKI, NIST Framework, DLP, Splunk, Python",BBA in Marketing | IIM Chennai | 2021 | CGPA: 8.3 || ---
Suresh Kulkarni,suresh.kulkarni65@gmail.com,+91-9433625477,linkedin.com/in/suresh-kulkarni3,"Chennai, India",Remote / Hybrid,"Strategic HRBP with 11 years partnering with business leaders at Razorpay. Expert in HR Analytics, Diversity & Inclusion and building high-performance cultures in fast-scaling organisations.","SuccessFactors, Labor Law, Workforce Planning, HRIS, Conflict Resolution, Employer Branding, Diversity & Inclusion, HR Analytics, Exit Management, Talent Acquisition",BBA in HR | VIT Ahmedabad | 2010 | CGPA: 8.5 || ---
Priya Kumar,priya.kumar22@gmail.com,+91-9199474211,linkedin.com/in/priya-kumar6,"Noida, India",Remote / Hybrid,Full-stack engineer with 8 years at companies like Oracle. Strong in MEDDIC and Enterprise Sales. Led rewrites of legacy systems to modern microservices architecture.,"Revenue Forecasting, Channel Partnerships, MEDDIC, Enterprise Sales",M.Tech in Software Engineering | NIT Pune | 2018 | CGPA: 7.3
Siddharth Choudhary,siddharth.choudhary70@gmail.com,+91-8257366852,linkedin.com/in/siddharth-choudhary2,"Ahmedabad, India",Remote / Hybrid,"Talent acquisition specialist with 10 years. Hired 47+ candidates across tech, product, and business functions. Passionate about Payroll and data-driven recruiting.","Training & Development, Change Management, Payroll, SAP HR, Employer Branding, Design Thinking, Storyboarding, Usability Testing",B.A. in Psychology | NIT Noida | 2016 | CGPA: 8.4 || ---
Varun Naidu,varun.naidu80@gmail.com,+91-9276847316,linkedin.com/in/varun-naidu4,"Pune, India",Remote / Hybrid,"2+ years building scalable distributed systems at Unilever. Deep expertise in RabbitMQ, Tax Compliance and Redis. Known for writing clean, well-tested code and driving architectural decisions.","Jenkins, React, Redis, RabbitMQ, Kubernetes, GitHub Actions, Oracle Financials, Tax Compliance, QuickBooks, Financial Reporting",B.Tech in Computer Science | BITS Pilani Mumbai | 2020 | CGPA: 7.9 || ---
Natasha Kumar,natasha.kumar75@gmail.com,+91-7384798407,linkedin.com/in/natasha-kumar4,"Noida, India",Remote / Hybrid,"Finance professional with 11 years at IBM specialising in Kubernetes, Bash and regulatory compliance. Led teams through 38+ successful audits.","GitHub Actions, Bash, GCP, Service Mesh, Kubernetes, Terraform, EKS",M.Sc in Finance | IIM Ahmedabad | 2018 | CGPA: 9.7 || ---
