name,email,phone,linkedin,location,open_to,summary,skills,education
Gaurav Saxena,gaurav.saxena32@gmail.com,+91-9250175027,linkedin.com/in/gaurav-saxena7,"Mumbai, India",Remote / Hybrid,"UX researcher and designer with 7 years. Conducted 46+ user studies that directly shaped roadmap decisions. Proficient in A/B Testing, Motion Design and Framer.","Figma, Adobe XD, InVision, Framer, Zeplin, Design Systems, Visual Design, Motion Design, Design Thinking, A/B Testing",B.F.A in Visual Communication | NIT Mumbai | 2018 | CGPA: 9.6
Karan Bhatt,karan.bhatt73@gmail.com,+91-7563938317,linkedin.com/in/karan-bhatt5,"Noida, India",Remote / Hybrid,"Finance professional with 12 years at Apple specialising in Splunk, Burp Suite and regulatory compliance. Led teams through 37+ successful audits.","LBO Modeling, SAP, Financial Reporting, Treasury, IFRS, Splunk, OSCP, Burp Suite, DLP",MBA in Finance | NMIMS Delhi | 2020 | CGPA: 8.9 || ---
Ishita Tiwari,ishita.tiwari83@gmail.com,+91-7639565075,linkedin.com/in/ishita-tiwari1,"Noida, India",Remote / Hybrid,CA/MBA with 7+ years in PostgreSQL and gRPC at Razorpay. Managed portfolios worth ₹42Cr. Strong track record in cost reduction and financial optimisation.,"VBA, Tax Compliance, GAAP, FP&A, GraphQL, Redis, PostgreSQL, gRPC",PGDM in Finance | IIM Gurgaon | 2014 | CGPA: 8.6
Manish Mehta,manish.mehta58@gmail.com,+91-9682698800,linkedin.com/in/manish-mehta9,"Bangalore, India",Remote / Hybrid,"Talent acquisition specialist with 7 years. Hired 19+ candidates across tech, product, and business functions. Passionate about Growth Hacking and data-driven recruiting.","Conflict Resolution, HRIS, SAP HR, HRMS, Meta Ads, Growth Hacking, LinkedIn Ads, Salesforce",PGDM in HR | Manipal Ahmedabad | 2013 | CGPA: 9.4 || ---
Pooja Kulkarni,pooja.kulkarni32@gmail.com,+91-7106244067,linkedin.com/in/pooja-kulkarni1,"Ahmedabad, India",Remote / Hybrid,"DevOps engineer with 12+ years building cloud-native infrastructure at Mphasis. Managed 48K+ container workloads on Kubernetes. Expert in SQL, Miro and Confluence.","User Research, Confluence, JIRA, SQL, Miro",M.Tech in Cloud Computing | Delhi University Chennai | 2016 | CGPA: 8.3 || ---
Karan Shah,karan.shah84@gmail.com,+91-8273666431,linkedin.com/in/karan-shah4,"Jaipur, India",Remote / Hybrid,Brand and content strategist with 3 years at ShareChat. Deep expertise in Miro and building engaged communities. Led campaigns reaching 39M+ users.,"Wireframing, Scrum, PRD Writing, Customer Discovery, Miro",B.Sc in Mass Communication | NIT Kochi | 2016 | CGPA: 8.7
Amit Pandey,amit.pandey93@gmail.com,+91-8893604711,linkedin.com/in/amit-pandey9,"Kolkata, India",Remote / Hybrid,2+ years in MEDDIC and PPC at PhonePe. Consistently exceeded quota by 38%+ over last 35 years. Closed deals totalling ₹4Cr ARR.,"SDR, Cold Outreach, MEDDIC, Revenue Forecasting, Marketo, Brand Strategy, Email Marketing, PPC",B.A. in Business Administration | Manipal Kolkata | 2016 | CGPA: 8.3 || ---
Ananya Mehta,ananya.mehta97@gmail.com,+91-9275904742,linkedin.com/in/ananya-mehta7,"Chennai, India",Remote / Hybrid,Product designer with 2 years at OYO working across mobile and web platforms. Shipped 15+ end-to-end design projects. Passionate about Accounting and inclusive design.,"Treasury, M&A, IFRS, Accounting, SAP, DCF Analysis, Tax Compliance",B.Des in Interaction Design | Manipal Gurgaon | 2012 | CGPA: 7.9
Karan Bose,karan.bose60@gmail.com,+91-8612939207,linkedin.com/in/karan-bose9,"Pune, India",Remote / Hybrid,"9+ years designing intuitive, accessible products at Infosys used by 31M+ users. Expert in dbt and PostgreSQL. Known for translating complex problems into elegant solutions.","PostgreSQL, Pandas, dbt, BERT, Hadoop, BigQuery, TensorFlow",B.F.A in Visual Communication | VIT Chennai | 2016 | CGPA: 7.9 || ---
Harish Mishra,harish.mishra31@gmail.com,+91-7249716007,linkedin.com/in/harish-mishra3,"Mumbai, India",Remote / Hybrid,Full-stack engineer with 9 years at companies like ShareChat. Strong in Vue.js and React. Led rewrites of legacy systems to modern microservices architecture.,"Java, JavaScript, Django, Elasticsearch, RabbitMQ, CI/CD, React, Vue.js",M.Tech in Software Engineering | BITS Pilani Bangalore | 2014 | CGPA: 8.6
Swati Bose,swati.bose24@gmail.com,+91-8708910536,linkedin.com/in/swati-bose4,"Gurgaon, India",Remote / Hybrid,"UX researcher and designer with 3 years. Conducted 26+ user studies that directly shaped roadmap decisions. Proficient in Adobe XD, CRM and Market Research.","Zeplin, Adobe XD, A/B Testing, Framer, Lottie, Market Research, CRM, Marketing Automation",B.F.A in Visual Communication | VIT Noida | 2010 | CGPA: 7.8 || ---
Suresh Mishra,suresh.mishra38@gmail.com,+91-8228736988,linkedin.com/in/suresh-mishra1,"Noida, India",Remote / Hybrid,"Security engineer with 6 years building and operating SOC capabilities at EY. Expert in GitLab CI, Python and threat hunting. Reduced MTTD by 74%.","Datadog, GCP, Python, GitLab CI",CEH Certified | NIT Jaipur | 2009 | CGPA: 7.6 || ---
Harish Dubey,harish.dubey90@gmail.com,+91-9841657160,linkedin.com/in/harish-dubey7,"Gurgaon, India",Remote / Hybrid,"6+ years in offensive and defensive security at KPMG. Conducted 47+ penetration tests across web, mobile, and infrastructure. Holder of Visual Design and Framer certifications.","Prototyping, Framer, Visual Design, Card Sorting, Principle, Motion Design, Figma, Accessibility (WCAG)",CEH Certified | Manipal Kolkata | 2012 | CGPA: 9.7 || ---
Dev Tiwari,dev.tiwari72@gmail.com,+91-7938543226,linkedin.com/in/dev-tiwari3,"Hyderabad, India",Remote / Hybrid,"Performance marketer with 2 years scaling user acquisition at MakeMyTrip. Expert in Google Analytics, Affiliate Marketing and PR. Grew organic traffic by 77% YoY.","Google Analytics, Marketo, Salesforce, Conversion Rate Optimisation, Adobe Suite, Video Marketing, Affiliate Marketing, PR, Content Marketing, SEM",MBA in Marketing | NIT Chennai | 2015 | CGPA: 8.3 || ---
Vikram Verma,vikram.verma92@gmail.com,+91-7739204690,linkedin.com/in/vikram-verma3,"Kolkata, India",Remote / Hybrid,"Data scientist with 12 years applying Python, C++ and MLflow to solve complex business problems. Experience across recommendation systems, fraud detection, and demand forecasting.","Spark, MLflow, Python, Keras, Transformers, Kubeflow, Redis, C++, JavaScript",B.Sc in Statistics | NMIMS Ahmedabad | 2009 | CGPA: 8.9 || ---
Aryan Singh,aryan.singh20@gmail.com,+91-8250898378,linkedin.com/in/aryan-singh8,"Kolkata, India",Remote / Hybrid,"SRE with 6 years ensuring 29% availability for systems serving 46M+ users at Oracle. Passionate about Datadog, observability, and eliminating toil.","Jenkins, ArgoCD, Prometheus, Loki, Datadog, New Relic, Linux, Istio, FluxCD, Nginx",AWS Certified Solutions Architect | NMIMS Pune | 2013 | CGPA: 8.3 || ---
Rohit Choudhary,rohit.choudhary21@gmail.com,+91-9597012539,linkedin.com/in/rohit-choudhary4,"Hyderabad, India",Remote / Hybrid,Full-stack engineer with 10 years at companies like Swiggy. Strong in GCP and Angular. Led rewrites of legacy systems to modern microservices architecture.,"GCP, Angular, Redis, GraphQL, Rust, DCF Analysis, Investment Banking, Risk Analysis",B.Sc in Computer Science | Delhi University Jaipur | 2010 | CGPA: 7.4
Varun Das,varun.das92@gmail.com,+91-8532962151,linkedin.com/in/varun-das2,"Gurgaon, India",Remote / Hybrid,"Performance marketer with 11 years scaling user acquisition at Swiggy. Expert in Salesforce, Programmatic Advertising and Adobe Suite. Grew organic traffic by 76% YoY.","SEO, Google Ads, Salesforce, Brand Strategy, CRM, Programmatic Advertising, Influencer Marketing, Marketing Automation, Adobe Suite, Video Marketing",B.Sc in Mass Communication | Delhi University Kolkata | 2014 | CGPA: 9.7 || ---
Meera Desai,meera.desai71@gmail.com,+91-8860474498,linkedin.com/in/meera-desai1,"Gurgaon, India",Remote / Hybrid,Cloud architect with 4 years at Capgemini designing multi-region infrastructure on Consul and Python. Reduced infrastructure spend by ₹31Cr through right-sizing and reserved instances.,"Vault, Consul, Service Mesh, Terraform, Python, Azure, Prometheus, Onboarding, Talent Acquisition, Change Management",CKA Certified | VIT Bangalore | 2010 | CGPA: 9.6
Ishita Saxena,ishita.saxena61@gmail.com,+91-9890755330,linkedin.com/in/ishita-saxena9,"Chennai, India",Remote / Hybrid,Enterprise sales professional with 2 years at Zerodha selling Cold Outreach solutions to C-suite buyers. Built and managed pipeline of ₹45Cr+ across 9 industry verticals.,"HubSpot, Lead Generation, Cold Outreach, LinkedIn Sales Navigator, Negotiation, Cross-selling, SPIN Selling, Enterprise Sales",MBA in Sales & Marketing | BITS Pilani Bangalore | 2022 | CGPA: 7.3 || ---
Dev Malhotra,dev.malhotra75@gmail.com,+91-8733578691,linkedin.com/in/dev-malhotra9,"Hyderabad, India",Remote / Hybrid,"Talent acquisition specialist with 7 years. Hired 33+ candidates across tech, product, and business functions. Passionate about CRM and data-driven recruiting.","Diversity & Inclusion, SuccessFactors, HR Analytics, Labor Law, Growth Hacking, Community Management, CRM, Email Marketing",M.Sc in Organisational Psychology | BITS Pilani Ahmedabad | 2018 | CGPA: 9.1 || ---
Aisha Menon,aisha.menon75@gmail.com,+91-7570752608,linkedin.com/in/aisha-menon7,"Pune, India",Remote / Hybrid,"DevOps engineer with 8+ years building cloud-native infrastructure at MakeMyTrip. Managed 32K+ container workloads on Kubernetes. Expert in GitHub Actions, Datadog and TypeScript.","Azure, GitHub Actions, Nginx, ArgoCD, Datadog, TypeScript, Terraform",B.E. in IT | VIT Pune | 2021 | CGPA: 7.2 || ---
Karan Agarwal,karan.agarwal18@gmail.com,+91-7272938069,linkedin.com/in/karan-agarwal4,"Pune, India",Remote / Hybrid,"Talent acquisition specialist with 12 years. Hired 25+ candidates across tech, product, and business functions. Passionate about Infrastructure as Code and data-driven recruiting.","Site Reliability Engineering, Loki, Infrastructure as Code, GKE",M.A. in Labour Relations | NIT Mumbai | 2011 | CGPA: 8.1 || ---
Kunal Mishra,kunal.mishra17@gmail.com,+91-8323918197,linkedin.com/in/kunal-mishra8,"Chennai, India",Remote / Hybrid,"DevOps engineer with 4+ years building cloud-native infrastructure at Freshworks. Managed 50K+ container workloads on Kubernetes. Expert in PKI, FluxCD and Jenkins.","GitLab CI, Go, Jenkins, Service Mesh, Loki, FluxCD, PKI, Splunk",B.Sc in Computer Science | NMIMS Kochi | 2016 | CGPA: 9.6
Natasha Sethi,natasha.sethi59@gmail.com,+91-7378808160,linkedin.com/in/natasha-sethi3,"Kolkata, India",Remote / Hybrid,Enterprise sales professional with 9 years at Meesho selling Cross-selling solutions to C-suite buyers. Built and managed pipeline of ₹23Cr+ across 7 industry verticals.,"SPIN Selling, Cross-selling, B2B Sales, CRM, Terraform, Python, GCP, REST APIs",BBA | BITS Pilani Noida | 2019 | CGPA: 8.2 || ---
Kabir Iyer,kabir.iyer43@gmail.com,+91-8450006976,linkedin.com/in/kabir-iyer2,"Bangalore, India",Remote / Hybrid,"Talent acquisition specialist with 8 years. Hired 50+ candidates across tech, product, and business functions. Passionate about PRD Writing and data-driven recruiting.","Amplitude, Stakeholder Management, Competitive Analysis, A/B Testing, Kanban, Confluence, MoSCoW, PRD Writing",M.A. in Labour Relations | Manipal Kolkata | 2014 | CGPA: 8.5 || ---
Aakash Das,aakash.das98@gmail.com,+91-9332107967,linkedin.com/in/aakash-das7,"Hyderabad, India",Remote / Hybrid,"5+ years designing intuitive, accessible products at ICICI Bank used by 10M+ users. Expert in Framer and Usability Testing. Known for translating complex problems into elegant solutions.","Adobe XD, Framer, Prototyping, Wireframing, Usability Testing, Interaction Design, Information Architecture, Accessibility (WCAG), Heuristic Evaluation, A/B Testing, Motion Design",Diploma in UI/UX | NIT Kochi | 2022 | CGPA: 7.6 || ---
Dev Patel,dev.patel39@gmail.com,+91-7161777067,linkedin.com/in/dev-patel6,"Jaipur, India",Remote / Hybrid,Full-stack engineer with 7 years at companies like Zoho. Strong in Figma and Design Thinking. Led rewrites of legacy systems to modern microservices architecture.,"Wireframing, Figma, Design Systems, Design Thinking, Motion Design",B.Sc in Computer Science | NMIMS Noida | 2016 | CGPA: 7.3
Kavya Joshi,kavya.joshi33@gmail.com,+91-9393549438,linkedin.com/in/kavya-joshi5,"Delhi, India",Remote / Hybrid,"5+ years in offensive and defensive security at Razorpay. Conducted 32+ penetration tests across web, mobile, and infrastructure. Holder of PRD Writing and Competitive Analysis certifications.","User Research, MoSCoW, Confluence, Amplitude, PRD Writing, Competitive Analysis",M.Tech in Information Security | IIM Ahmedabad | 2014 | CGPA: 9.5 || ---
Yash Mishra,yash.mishra26@gmail.com,+91-9367176821,linkedin.com/in/yash-mishra8,"Noida, India",Remote / Hybrid,"Strategic HRBP with 2 years partnering with business leaders at boAt. Expert in Excel, Tally and building high-performance cultures in fast-scaling organisations.","Excel, Tally, DCF Analysis, Budgeting",B.A. in Psychology | IIM Kolkata | 2015 | CGPA: 7.3 || ---
Shruti Patel,shruti.patel99@gmail.com,+91-9431472326,linkedin.com/in/shruti-patel3,"Noida, India",Remote / Hybrid,CA/MBA with 10+ years in Information Architecture and Zeplin at Morgan Stanley. Managed portfolios worth ₹46Cr. Strong track record in cost reduction and financial optimisation.,"Storyboarding, Lottie, Zeplin, A/B Testing, Information Architecture",M.Com in Accounting | VIT Gurgaon | 2021 | CGPA: 7.7 || ---
Kabir Arora,kabir.arora64@gmail.com,+91-7535261278,linkedin.com/in/kabir-arora7,"Delhi, India",Remote / Hybrid,8+ years as a ML Engineer specialising in KPIs and Usability Testing. Built production ML systems at TCS serving 50M+ users. Published 2 internal research papers.,"KPIs, Feature Prioritisation, Usability Testing, MoSCoW, Product Analytics, A/B Testing, Competitive Analysis",B.Tech in Computer Science | IIM Kochi | 2009 | CGPA: 9.3 || ---
Rishabh Shah,rishabh.shah31@gmail.com,+91-8958168879,linkedin.com/in/rishabh-shah7,"Ahmedabad, India",Remote / Hybrid,"SRE with 3 years ensuring 23% availability for systems serving 5M+ users at Zoho. Passionate about Azure, observability, and eliminating toil.","Azure, Loki, Terraform, Grafana, ArgoCD, AWS, Succession Planning, Talent Acquisition, Change Management, HRIS",B.Tech in Computer Science | Manipal Chennai | 2018 | CGPA: 7.2
Suresh Menon,suresh.menon66@gmail.com,+91-8606257674,linkedin.com/in/suresh-menon1,"Kochi, India",Remote / Hybrid,InfoSec professional with 8 years at Infosys specialising in Forensics and cloud security. Led organisation through ISO 27001 certification and 33+ audits.,"Splunk, SOC Operations, Incident Response, CISSP, Bash, Burp Suite, Forensics, Metasploit, IAM, Cryptography",M.Tech in Information Security | NMIMS Kolkata | 2022 | CGPA: 7.4 || ---
Aisha Reddy,aisha.reddy17@gmail.com,+91-7492061697,linkedin.com/in/aisha-reddy3,"Noida, India",Remote / Hybrid,"DevOps engineer with 11+ years building cloud-native infrastructure at Groww. Managed 45K+ container workloads on Kubernetes. Expert in Investment Banking, Financial Modeling and CFA.","CFA, Investment Banking, Tally, Financial Modeling, CA, Treasury",B.Tech in Computer Science | Manipal Hyderabad | 2010 | CGPA: 7.4 || ---
Arjun Iyer,arjun.iyer95@gmail.com,+91-9850721503,linkedin.com/in/arjun-iyer9,"Kochi, India",Remote / Hybrid,Full-stack engineer with 9 years at companies like Zomato. Strong in FastAPI and MongoDB. Led rewrites of legacy systems to modern microservices architecture.,"JavaScript, Rust, React, Angular, Vue.js, FastAPI, SQL, MongoDB, Jenkins, GraphQL, Go, Kafka",B.Tech in Computer Science | NMIMS Chennai | 2021 | CGPA: 8.3
Sneha Kulkarni,sneha.kulkarni34@gmail.com,+91-7783314618,linkedin.com/in/sneha-kulkarni4,"Ahmedabad, India",Remote / Hybrid,"Finance professional with 5 years at Cognizant specialising in Excel, HubSpot and regulatory compliance. Led teams through 18+ successful audits.","Valuation, Excel, Treasury, QuickBooks, HubSpot, B2B Sales",B.Com in Finance | VIT Kochi | 2019 | CGPA: 8.8 || ---
Zara Iyer,zara.iyer98@gmail.com,+91-9953042013,linkedin.com/in/zara-iyer3,"Kochi, India",Remote / Hybrid,Investment analyst with 10 years covering GAAP and Accounting. Built 47+ financial models supporting ₹6Cr+ in deals. CFA Level 2 cleared.,"Excel, Valuation, GAAP, Oracle Financials, FP&A, Auditing, CFA, Accounting, SAP, DCF Analysis",MBA in Finance | Manipal Pune | 2010 | CGPA: 7.6 || ---
Shreya Pillai,shreya.pillai63@gmail.com,+91-8531785885,linkedin.com/in/shreya-pillai5,"Bangalore, India",Remote / Hybrid,Product designer with 9 years at Deloitte working across mobile and web platforms. Shipped 10+ end-to-end design projects. Passionate about Budgeting and inclusive design.,"User Flows, Framer, Motion Design, HTML/CSS, Risk Analysis, Budgeting, Auditing, IFRS",Diploma in UI/UX | VIT Ahmedabad | 2018 | CGPA: 7.8
Simran Chatterjee,simran.chatterjee70@gmail.com,+91-9146627321,linkedin.com/in/simran-chatterjee8,"Delhi, India",Remote / Hybrid,CA/MBA with 2+ years in Linux and Rust at Lenskart. Managed portfolios worth ₹47Cr. Strong track record in cost reduction and financial optimisation.,"Rust, SQL, Elasticsearch, Linux, Angular, Spring Boot, Git",M.Sc in Finance | BITS Pilani Delhi | 2016 | CGPA: 7.3
Aditi Naidu,aditi.naidu90@gmail.com,+91-7835948208,linkedin.com/in/aditi-naidu7,"Jaipur, India",Remote / Hybrid,"Product manager with 4 years driving 0-to-1 products and scaling existing ones. Deep expertise in Keras, Kafka and working at the intersection of business, design, and engineering.","Kafka, Computer Vision, Keras, NumPy, R",M.S. in Management | VIT Noida | 2012 | CGPA: 9.7 || ---
Karan Verma,karan.verma98@gmail.com,+91-8572501586,linkedin.com/in/karan-verma4,"Chennai, India",Remote / Hybrid,HR leader with 4+ years at PwC specialising in Accessibility (WCAG) and Information Architecture. Built hiring pipelines for 50+ roles annually. Reduced attrition by 80% through targeted retention programmes.,"Accessibility (WCAG), Motion Design, Storyboarding, Information Architecture",MBA in Human Resources | VIT Bangalore | 2020 | CGPA: 8.7 || ---
Rishabh Chopra,rishabh.chopra36@gmail.com,+91-7698675591,linkedin.com/in/rishabh-chopra5,"Mumbai, India",Remote / Hybrid,"Talent acquisition specialist with 2 years. Hired 26+ candidates across tech, product, and business functions. Passionate about Salesforce and data-driven recruiting.","PR, Brand Strategy, Salesforce, Adobe Suite, Google Analytics, Programmatic Advertising",PGDM in HR | BITS Pilani Mumbai | 2021 | CGPA: 7.6 || ---
Vivek Choudhary,vivek.choudhary66@gmail.com,+91-7250671241,linkedin.com/in/vivek-choudhary8,"Jaipur, India",Remote / Hybrid,Investment analyst with 2 years covering Compensation & Benefits and Change Management. Built 8+ financial models supporting ₹5Cr+ in deals. CFA Level 3 cleared.,"Talent Acquisition, Exit Management, Conflict Resolution, Compensation & Benefits, Change Management",CA (Chartered Accountant) | Delhi University Hyderabad | 2020 | CGPA: 9.1 || ---
Aakash Ghosh,aakash.ghosh49@gmail.com,+91-9604379970,linkedin.com/in/aakash-ghosh9,"Delhi, India",Remote / Hybrid,"Talent acquisition specialist with 7 years. Hired 28+ candidates across tech, product, and business functions. Passionate about System Design and data-driven recruiting.","HRIS, Diversity & Inclusion, Change Management, Talent Acquisition, HRMS, System Design, Python, Kubernetes, AWS",PGDM in HR | VIT Bangalore | 2022 | CGPA: 8.4
Deepak Das,deepak.das88@gmail.com,+91-8801450885,linkedin.com/in/deepak-das7,"Kochi, India",Remote / Hybrid,Full-stack engineer with 8 years at companies like Accenture. Strong in Scikit-learn and MLflow. Led rewrites of legacy systems to modern microservices architecture.,"MLflow, Hive, Time Series, Data Modeling, Scikit-learn, Keras, NumPy, Statistics",M.S. in Computer Science | Manipal Gurgaon | 2012 | CGPA: 8.8
Pooja Malhotra,pooja.malhotra25@gmail.com,+91-8355138246,linkedin.com/in/pooja-malhotra4,"Chennai, India",Remote / Hybrid,"DevOps engineer with 10+ years building cloud-native infrastructure at Apple. Managed 33K+ container workloads on Kubernetes. Expert in Onboarding, Employee Relations and Succession Planning.","Payroll, HRIS, SuccessFactors, Employee Relations, Succession Planning, Onboarding, Workday, Workforce Planning",B.Tech in Computer Science | NMIMS Bangalore | 2020 | CGPA: 7.7 || ---
Nandini Patel,nandini.patel43@gmail.com,+91-9995222813,linkedin.com/in/nandini-patel3,"Noida, India",Remote / Hybrid,"Passionate Senior Software Engineer with 12 years of experience across backend and cloud infrastructure. Proficient in B2B Sales, MEDDIC, SDR. Delivered systems handling millions of requests per day.","Salesforce, MEDDIC, B2B Sales, SDR",B.Tech in Computer Science | NMIMS Kochi | 2019 | CGPA: 8.2
Vikram Rao,vikram.rao82@gmail.com,+91-7647527259,linkedin.com/in/vikram-rao3,"Jaipur, India",Remote / Hybrid,Product designer with 5 years at SAP working across mobile and web platforms. Shipped 3+ end-to-end design projects. Passionate about Card Sorting and inclusive design.,"Card Sorting, Wireframing, Motion Design, Sketch, Prototyping, Heuristic Evaluation, Design Systems, Customer Discovery, A/B Testing, MoSCoW",Diploma in UI/UX | Manipal Hyderabad | 2012 | CGPA: 7.3
Harish Verma,harish.verma85@gmail.com,+91-8584139340,linkedin.com/in/harish-verma3,"Delhi, India",Remote / Hybrid,"ML engineer with 12 years at Nykaa bridging research and production. Expert in Marketo and Community Management model deployment, monitoring, and retraining pipelines.","Community Management, Salesforce, Marketo, CRM, SEM, Marketing Automation, Video Marketing",B.Sc in Statistics | NMIMS Gurgaon | 2017 | CGPA: 8.8 || ---
Ishita Bose,ishita.bose26@gmail.com,+91-9504971344,linkedin.com/in/ishita-bose8,"Chennai, India",Remote / Hybrid,Investment analyst with 3 years covering Accounting and CFA. Built 34+ financial models supporting ₹5Cr+ in deals. CFA Level 1 cleared.,"Equity Research, CFA, Due Diligence, Accounting, Marketing Automation, Community Management",B.Com in Finance | NIT Kochi | 2017 | CGPA: 8.7
Nandini Das,nandini.das32@gmail.com,+91-9794818977,linkedin.com/in/nandini-das6,"Hyderabad, India",Remote / Hybrid,Investment analyst with 11 years covering Pipeline Management and Excel. Built 26+ financial models supporting ₹8Cr+ in deals. CFA Level 2 cleared.,"IFRS, Equity Research, Excel, CA, Bloomberg Terminal, Financial Reporting, Pipeline Management, Demo Skills, Channel Partnerships",PGDM in Finance | IIT Jaipur | 2010 | CGPA: 9.6
Aryan Pillai,aryan.pillai52@gmail.com,+91-8261926741,linkedin.com/in/aryan-pillai1,"Kolkata, India",Remote / Hybrid,Cloud architect with 3 years at Oracle designing multi-region infrastructure on M&A and Investment Banking. Reduced infrastructure spend by ₹38Cr through right-sizing and reserved instances.,"DCF Analysis, Valuation, Credit Analysis, M&A, FP&A, Investment Banking, Equity Research, Financial Modeling",B.Tech in Computer Science | VIT Ahmedabad | 2014 | CGPA: 7.3 || ---
Natasha Agarwal,natasha.agarwal10@gmail.com,+91-8544991514,linkedin.com/in/natasha-agarwal4,"Jaipur, India",Remote / Hybrid,"Finance professional with 3 years at Tech Mahindra specialising in Jenkins, Helm and regulatory compliance. Led teams through 25+ successful audits.","GKE, Site Reliability Engineering, FluxCD, Jenkins, Go, Helm",CFA Level II | VIT Mumbai | 2011 | CGPA: 8.6 || ---
Rahul Kapoor,rahul.kapoor79@gmail.com,+91-8610656550,linkedin.com/in/rahul-kapoor1,"Bangalore, India",Remote / Hybrid,"Performance marketer with 5 years scaling user acquisition at Nykaa. Expert in Email Marketing, Google Analytics and CRM. Grew organic traffic by 14% YoY.","Google Analytics, Marketo, Content Marketing, CRM, PPC, Adobe Suite, Email Marketing, Social Media",B.Sc in Mass Communication | VIT Noida | 2014 | CGPA: 9.3 || ---
Arjun Saxena,arjun.saxena76@gmail.com,+91-9753832286,linkedin.com/in/arjun-saxena1,"Chennai, India",Remote / Hybrid,CA/MBA with 12+ years in React and Node.js at Netflix. Managed portfolios worth ₹37Cr. Strong track record in cost reduction and financial optimisation.,"Azure, CI/CD, Node.js, Git, React",PGDM in Finance | NMIMS Noida | 2010 | CGPA: 7.6 || ---
Siddharth Chopra,siddharth.chopra50@gmail.com,+91-8707729724,linkedin.com/in/siddharth-chopra7,"Delhi, India",Remote / Hybrid,Enterprise sales professional with 11 years at Airbnb selling REST APIs solutions to C-suite buyers. Built and managed pipeline of ₹36Cr+ across 8 industry verticals.,"FastAPI, REST APIs, MongoDB, Microservices",B.Com | Delhi University Mumbai | 2011 | CGPA: 9.1 || ---
Arjun Reddy,arjun.reddy13@gmail.com,+91-8756984985,linkedin.com/in/arjun-reddy2,"Bangalore, India",Remote / Hybrid,HR leader with 7+ years at Mphasis specialising in Payroll and Labor Law. Built hiring pipelines for 24+ roles annually. Reduced attrition by 65% through targeted retention programmes.,"Talent Acquisition, Performance Management, Labor Law, Training & Development, Compensation & Benefits, HR Analytics, Diversity & Inclusion, LinkedIn Recruiter, HRIS, Payroll",M.Sc in Organisational Psychology | NIT Ahmedabad | 2020 | CGPA: 8.1
Harish Malhotra,harish.malhotra53@gmail.com,+91-7525042575,linkedin.com/in/harish-malhotra4,"Kolkata, India",Remote / Hybrid,"10+ years building scalable distributed systems at OYO. Deep expertise in Excel, Risk Analysis and Financial Reporting. Known for writing clean, well-tested code and driving architectural decisions.","Valuation, CA, Risk Analysis, LBO Modeling, Excel, Financial Reporting",B.Tech in Computer Science | NMIMS Kochi | 2014 | CGPA: 9.7 || ---
